Date,Period Type,Total Leads,Qualified Leads,Conversion Rate (%),Total Orders,Revenue,Average Order Value,Top Product Category,Notes
2026-01-01,Monthly,45,18,40.00,8,3500000,437500,Hospital,Strong month for healthcare sector
2025-12-01,Monthly,38,15,39.47,6,2800000,466667,Hotel,Holiday season boost for hospitality
2025-11-01,Monthly,42,16,38.10,7,3200000,457143,Hospital,Expansion of existing hospital clients
2026-01-08,Weekly,12,5,41.67,2,900000,450000,Hospital,Good conversion on urgent timeline leads
2026-01-01,Weekly,8,3,37.50,1,450000,450000,Hotel,Post-holiday slowdown
